[
  {
    "title": "Orientation and learning methods",
    "slug": "orientation",
    "domain": "foundations",
    "track": "learning-methods",
    "module": "f.learning-with-ai",
    "concept": "orientation",
    "level": "beginner",
    "type": "stage",
    "prerequisites": [],
    "learning_objectives": [
      "Identify the stage's knowledge requirements and evidence of readiness"
    ],
    "next": [
      "foundations"
    ],
    "estimated_time": 30,
    "tools": [],
    "status": "outline",
    "references": [
      "references/erickson-sources.json"
    ],
    "source": "curriculum/00-orientation/README.md",
    "language": "en"
  },
  {
    "title": "Foundations readiness map",
    "slug": "foundations",
    "domain": "foundations",
    "track": "learning-methods",
    "module": null,
    "concept": "foundations-readiness",
    "level": "beginner",
    "type": "stage",
    "prerequisites": [
      "orientation"
    ],
    "learning_objectives": [
      "Identify the stage's knowledge requirements and evidence of readiness"
    ],
    "next": [
      "prerequisite-path-zh",
      "dc-circuit-fundamentals",
      "components"
    ],
    "estimated_time": 30,
    "tools": [],
    "status": "outline",
    "references": [
      "references/erickson-sources.json",
      "references/undergraduate-sources.json"
    ],
    "source": "curriculum/01-foundations/README.md",
    "language": "en"
  },
  {
    "title": "电力电子之前：先修课程路线",
    "slug": "prerequisite-path-zh",
    "domain": "foundations",
    "track": "learning-methods",
    "module": null,
    "concept": "prerequisite-path",
    "level": "beginner",
    "type": "guide",
    "prerequisites": [
      "orientation"
    ],
    "learning_objectives": [
      "Identify the stage's knowledge requirements and evidence of readiness"
    ],
    "next": [
      "first-circuit-zh"
    ],
    "estimated_time": 30,
    "tools": [],
    "status": "outline",
    "references": [
      "references/erickson-sources.json",
      "references/undergraduate-sources.json"
    ],
    "source": "curriculum/01-foundations/prerequisite-path.zh-CN.md",
    "language": "zh-CN"
  },
  {
    "title": "一个简单电路用了多少电？",
    "slug": "first-circuit-zh",
    "domain": "foundations",
    "track": "circuits",
    "module": "f.dc-circuits",
    "covers": [
      "f.quantities"
    ],
    "concept": "first-circuit",
    "level": "beginner",
    "type": "lesson",
    "prerequisites": [],
    "learning_objectives": [
      "区分电压、电流、功率和能量",
      "计算理想电阻电路并解释单位"
    ],
    "next": [
      "dc-circuit-fundamentals",
      "components"
    ],
    "estimated_time": 30,
    "tools": [],
    "status": "available",
    "references": [
      "references/erickson-sources.json",
      "references/undergraduate-sources.json"
    ],
    "academic_references": [
      "mit-6-002-2007"
    ],
    "source": "curriculum/01-foundations/first-lesson.zh-CN.md",
    "language": "zh-CN"
  },
  {
    "title": "DC circuit fundamentals: voltage, current, power and the circuit laws",
    "slug": "dc-circuit-fundamentals",
    "domain": "foundations",
    "track": "circuits",
    "module": "f.dc-circuits",
    "covers": [
      "f.quantities"
    ],
    "concept": "dc-circuit-fundamentals",
    "level": "beginner",
    "type": "lesson",
    "format": "aipe-lesson-v2",
    "prerequisites": [
      "orientation"
    ],
    "learning_objectives": [
      "Define voltage, current, resistance, power and energy with SI units and distinguish W from Wh",
      "Apply Ohm's law, KCL and KVL to series, parallel and loaded-divider circuits",
      "Verify hand calculations with a reproducible Python lab and interpret model limits"
    ],
    "next": [
      "components",
      "buck-converter-fundamentals",
      "three-phase-fundamentals"
    ],
    "estimated_time": 90,
    "tools": [
      {
        "id": "python",
        "licence_class": "open_source",
        "optional": false
      }
    ],
    "status": "available",
    "references": [
      "references/mit-ocw-catalogue.json",
      "references/undergraduate-sources.json"
    ],
    "academic_references": [
      "mit-6-002-2007",
      "mit-8-02-2007",
      "mit-18-01sc-2010"
    ],
    "labs": [
      "labs/foundations/dc_circuits.py"
    ],
    "source": "curriculum/foundations/circuits/dc-circuit-fundamentals.md",
    "language": "en"
  },
  {
    "title": "Devices and switching models",
    "slug": "components",
    "domain": "power-electronics",
    "track": "devices-and-components",
    "module": "pe.devices",
    "covers": [
      "pe.passives"
    ],
    "concept": "components-stage",
    "level": "undergraduate",
    "type": "stage",
    "prerequisites": [
      "foundations"
    ],
    "learning_objectives": [
      "Identify the stage's knowledge requirements and evidence of readiness"
    ],
    "next": [
      "converters"
    ],
    "estimated_time": 30,
    "tools": [],
    "status": "outline",
    "references": [
      "references/erickson-sources.json"
    ],
    "source": "curriculum/02-components/README.md",
    "language": "en"
  },
  {
    "title": "Steady-state converters",
    "slug": "converters",
    "domain": "power-electronics",
    "track": "dc-dc-conversion",
    "module": "pe.topologies",
    "covers": [
      "pe.boost",
      "pe.rectifiers",
      "pe.inverters",
      "pe.isolated",
      "pe.losses"
    ],
    "concept": "converters-stage",
    "level": "undergraduate",
    "type": "stage",
    "prerequisites": [
      "components"
    ],
    "learning_objectives": [
      "Identify the stage's knowledge requirements and evidence of readiness"
    ],
    "next": [
      "buck-converter-fundamentals",
      "buck-converter",
      "buck-open-lab",
      "dynamics-and-control"
    ],
    "estimated_time": 30,
    "tools": [],
    "status": "outline",
    "references": [
      "references/erickson-sources.json"
    ],
    "source": "curriculum/03-converters/README.md",
    "language": "en"
  },
  {
    "title": "Buck converter fundamentals: from switch states to ripple and conduction modes",
    "slug": "buck-converter-fundamentals",
    "domain": "power-electronics",
    "track": "dc-dc-conversion",
    "module": "pe.buck",
    "covers": [
      "pe.topologies"
    ],
    "concept": "buck-converter-fundamentals",
    "level": "undergraduate",
    "type": "lesson",
    "format": "aipe-lesson-v2",
    "prerequisites": [
      "dc-circuit-fundamentals",
      "converters"
    ],
    "learning_objectives": [
      "Explain buck operation from the two switch states and their current paths",
      "Derive the conversion ratio from volt-second balance and the inductor ripple from the on-interval",
      "Identify the CCM/DCM boundary and compare analytical predictions with a switching simulation",
      "State the limits of the ideal model and what losses, ESR and startup change"
    ],
    "next": [
      "buck-open-lab",
      "buck-converter",
      "dynamics-and-control"
    ],
    "estimated_time": 120,
    "tools": [
      {
        "id": "python",
        "licence_class": "open_source",
        "optional": false
      }
    ],
    "status": "available",
    "references": [
      "references/mit-ocw-catalogue.json",
      "references/erickson-sources.json"
    ],
    "academic_references": [
      "mit-6-622-2023",
      "mit-6-334-2007",
      "mit-6-002-2007"
    ],
    "labs": [
      "labs/buck_open.py",
      "labs/power-electronics/buck_switching.py"
    ],
    "source": "curriculum/power-electronics/dc-dc-conversion/buck-converter-fundamentals.md",
    "language": "en"
  },
  {
    "title": "Buck converter: from principles to design",
    "slug": "buck-converter",
    "domain": "power-electronics",
    "track": "dc-dc-conversion",
    "module": "pe.buck",
    "covers": [
      "pe.modelling",
      "pe.control",
      "pe.practical"
    ],
    "concept": "buck-converter-design",
    "level": "undergraduate",
    "type": "tutorial",
    "prerequisites": [
      "converters"
    ],
    "learning_objectives": [
      "Explain buck energy transfer and continuous conduction assumptions",
      "Connect averaged models to control and physical implementation limits"
    ],
    "next": [
      "buck-open-lab"
    ],
    "estimated_time": 120,
    "tools": [
      {
        "id": "matlab",
        "licence_class": "commercial",
        "optional": true
      },
      {
        "id": "plecs",
        "licence_class": "commercial",
        "optional": true
      },
      {
        "id": "ltspice",
        "licence_class": "free_proprietary",
        "optional": true
      }
    ],
    "status": "draft",
    "references": [
      "references/erickson-sources.json",
      "references/website-migration.json"
    ],
    "academic_references": [
      "mit-6-622-2023",
      "mit-6-334-2007"
    ],
    "source": "curriculum/03-converters/buck-converter.md",
    "language": "en"
  },
  {
    "title": "Predict and check an ideal buck converter",
    "slug": "buck-open-lab",
    "domain": "power-electronics",
    "track": "dc-dc-conversion",
    "module": "pe.buck",
    "concept": "buck-open-lab",
    "level": "undergraduate",
    "type": "lab",
    "prerequisites": [
      "converters"
    ],
    "learning_objectives": [
      "Derive volt-second balance and ripple in SI units",
      "Detect failure of a continuous conduction assumption"
    ],
    "next": [
      "dynamics-and-control"
    ],
    "estimated_time": 45,
    "tools": [
      {
        "id": "python",
        "licence_class": "open_source",
        "optional": false
      }
    ],
    "status": "available",
    "references": [
      "references/erickson-sources.json"
    ],
    "academic_references": [
      "mit-6-622-2023"
    ],
    "labs": [
      "labs/buck_open.py"
    ],
    "source": "curriculum/03-converters/buck-open-lab.md",
    "language": "en"
  },
  {
    "title": "Dynamics, transfer functions and control",
    "slug": "dynamics-and-control",